{
  "reviewerID": "H1J2K3L4M5N6P7",
  "asin": "B0E5F6G7H8",
  "reviewerName": null,
  "helpful": [1, 3],
  "reviewText": "Dữ liệu hợp lệ về cấu trúc nhưng có tổ hợp nghiệp vụ cần cảnh báo.",
  "overall": 3.0,
  "summary": "Cần xem lại",
  "unixReviewTime": 1714521600,
  "reviewTime": "05 01, 2024",
  "day_diff": 90,
  "helpful_yes": 1,
  "total_vote": 3,
  "productName": "Laptop Nike Air",
  "category": "Điện tử",
  "sub_category": "Laptop",
  "brand": "Nike",
  "unitPrice": 1000000.0,
  "orderID": "ORD-Z9Y8X7W6V5",
  "quantity": 1,
  "totalAmount": 1000000.0,
  "storeID": "STR-MIỀ-5",
  "storeName": "Store Đà Nẵng 1",
  "city": "Đà Nẵng",
  "region": "Miền Trung",
  "storeType": "Mobile App",
  "paymentID": "PAY-U4T3S2R1Q0",
  "paymentMethod": "Thẻ Tín Dụng",
  "paymentStatus": "Thất bại",
  "shippingID": "SHP-P9N8M7L6K5",
  "shippingMethod": "Hỏa tốc",
  "carrierName": "Giao Hàng Nhanh",
  "shippingStatus": "Đã giao"
}
