{
  "reviewerID": "A1B2C3D4E5F6G7",
  "asin": "B0A1B2C3D4",
  "reviewerName": "Nguyễn Minh Anh",
  "helpful": [12, 30],
  "reviewText": "Sản phẩm hoạt động ổn định và đúng với mô tả.",
  "overall": 4.0,
  "summary": "Sản phẩm tốt",
  "unixReviewTime": 1705276800,
  "reviewTime": "01 15, 2024",
  "day_diff": 120,
  "helpful_yes": 12,
  "total_vote": 30,
  "productName": "Laptop Apple Pro",
  "category": "Điện tử",
  "sub_category": "Laptop",
  "brand": "Apple",
  "unitPrice": 2500000.0,
  "orderID": "ORD-A1B2C3D4E5",
  "quantity": 2,
  "totalAmount": 5000000.0,
  "storeID": "STR-MIỀ-3",
  "storeName": "Store Hà Nội 2",
  "city": "Hà Nội",
  "region": "Miền Bắc",
  "storeType": "Web Online",
  "paymentID": "PAY-F6G7H8J9K0",
  "paymentMethod": "Momo",
  "paymentStatus": "Thành công",
  "shippingID": "SHP-L1M2N3P4Q5",
  "shippingMethod": "Tiêu chuẩn",
  "carrierName": "Viettel Post",
  "shippingStatus": "Đã giao"
}
